<?xml version="1.0"?>
<!DOCTYPE Students SYSTEM "8external.dtd">
	<Students>
		<student>
			<Roll_No>1234</Roll_No>
			<name>Tarak Mehta</name>
			<marks>
			<webtechnologies></webtechnologies>
			<XML></XML>
			<J2EE></J2EE>
			</marks>
			<rank>116</rank>
		</student>
		
		<student>
			<Roll_No>1444</Roll_No>
			<name>Mr.Iyer</name>
			<marks>
		
			<XML></XML>
			<J2EE></J2EE>
			<NS></NS>
			</marks>
			<rank>106</rank>
		</student>
	</Students>